奶茶店名称,地址,纬度,经度
书亦烧仙草(马湖店),洪山街道马湖新村广寰商贸楼1号楼1楼4号,30.480416,114.331623
书亦烧仙草(城投瀚城店),楚康路城投瀚城商铺40附13,30.506455,114.37667
书亦烧仙草(东西湖东山店),东山办事处街道东柏路284号,30.781531,114.027958
书亦烧仙草(循礼门大润发店),江汉路257号大润发超市1层1027号柜位,30.590465,114.29189
书亦烧仙草(武大工学部店),东湖南路武汉大学工学部十五舍负一楼,30.547816,114.372516
书亦烧仙草(盘龙城佳海店),盘龙城经济开发区盘龙城佳海环行路402号,30.73836,114.244258
书亦烧仙草(海林广场店),三秀路海林广场第壹层D-1004号店铺,30.629357,114.150497
书亦烧仙草(万科未来中心店),汉阳大道408号五里墩B1-1地块商业裙房万科未来中心B1层B1-24号,30.560068,114.250073
书亦烧仙草(蔡甸常福店),常福工业园福兴小区二期四号楼D-2附2,30.438572,114.044761
书亦烧仙草(紫润明园店),长丰村紫润明园北区38栋一层商网5,30.627402,114.21822
书亦烧仙草(蔡甸广场店),蔡甸街茂源街27附8,30.579982,114.047603
书亦烧仙草(京东大道店),余泊北路临99号阳逻港华中国际产业园d_s4厂房/单元1层7号,30.736002,114.583742
书亦烧仙草(沿海赛洛城店),沿海赛洛城24栋一单元1层02室,30.647357,114.161614
书亦烧仙草(广宏汇店),狮子山街芷岸龙庭4-2号商铺栋1层5室、6室、23室、24室,30.486486,114.340624
书亦烧仙草(阳逻军安北路店),阳逻街军安路16号其中一间,30.663287,114.58115
书亦烧仙草(武汉金地澜菲溪岸店),芳草六路金地澜菲溪岸E19栋103,30.518937,114.218487
书亦烧仙草(阳光明珠店),阳逻开发区阳光北路613号,30.674627,114.57979
书亦烧仙草(武汉蔡甸奓山广场店),奓山路联富路28号,30.456889,114.022863
书亦烧仙草(横店中百店),横店大街蓝色星城三期今古城3栋1层3号商铺,30.8049,114.300596
书亦烧仙草(生物城店),高新大道666号光谷生物城创新基地E区s6-103号商铺,30.487872,114.486799
书亦烧仙草(长江存储店),未来三路88号国家存储器基地项目一期生活馆三楼C-3-017单元,30.469382,114.61661
书亦烧仙草(惠民苑店),永丰街黄金口五村特1号惠民苑三期经济适用房33栋1-2层3-28室,30.591674,114.176745
书亦烧仙草(百尚购物中心店),滠口街滠口村汉北水晶城12栋1-3层1室,30.723646,114.356317
书亦烧仙草(中南拂晓城店),横店街道中南拂晓城一期第S2幢/单元1层商14号,30.767456,114.27606
CHAGEE霸王茶姬(江汉路Markmall店),京汉大道江汉路206号Markmall店（循礼门轻轨站J出入口）,30.590734,114.293272
CHAGEE霸王茶姬(江夏中百广场店),纸坊街文华路37号中百广场,30.370813,114.327791
CHAGEE霸王茶姬(武汉荟聚中心店),长宜路1号荟聚中心5号门2楼竹叶海中庭（迪卡侬对面）,30.622602,114.172927
CHAGEE霸王茶姬(黄陂广场店),"黄陂广场E1-137,138号铺",30.886868,114.381465
CHAGEE霸王茶姬(江汉路大洋百货店),中山大道756号大洋百货1楼A-12,30.583489,114.297168
CHAGEE霸王茶姬(happy站台店),中山大道818号负一层Happy站台C133号铺,30.58501,114.297923
CHAGEE霸王茶姬(武汉摩尔城店),龙阳大道特6号武汉摩尔城1层L1B-027-2号商铺,30.56478,114.214936
CHAGEE霸王茶姬(武汉天地店),中山大道武汉天地A4地块4号楼4-1-8单元1层Z31号,30.613484,114.316872
CHAGEE霸王茶姬(经开万达店),经济技术开发区万达广场F1-1005A,30.513259,114.180855
CHAGEE霸王茶姬(中商广场店),中南路9号中商广场一楼侧面1F-003铺位,30.543305,114.338256
CHAGEE霸王茶姬(汉口k11店),解放大道武汉K11购物艺术中心I馆负一层美食广场B110-B111-1号商铺,30.584717,114.270233
CHAGEE霸王茶姬(光谷天地店),光谷天地一层329-330号铺,30.483174,114.417246
CHAGEE霸王茶姬(武汉群星城店),徐东大街120号,30.59094,114.355378
CHAGEE霸王茶姬(越秀国金天地店),解放大道与新华路交叉口越秀武汉国金天地1层L1004号商铺-1,30.590745,114.283859
CHAGEE霸王茶姬(光谷金融港店),湖北省武汉市江夏区光谷金融港B22栋1楼1室05号商铺,30.462636,114.435526
CHAGEE霸王茶姬(金地广场店),团结大道1335号金地户外广场A1铺位,30.609534,114.391084
CHAGEE霸王茶姬(壹方北馆店),分金社区永和路8号壹方北馆2号门,30.62207,114.321493
CHAGEE霸王茶姬(武汉金融金树街店),临江大道9号金融街融御滨江A区2号楼1层4-5号商铺,30.546542,114.299112
CHAGEE霸王茶姬(南湖时尚城店),南湖大道116号南湖时尚城K4b栋1层商铺1号,30.484018,114.393275
CHAGEE霸王茶姬(凯德西城店),解放大道18号凯德广场西城购物中心01层02B号商铺,30.603108,114.200749
CHAGEE霸王茶姬(三联readway店),江汉路花楼街口江汉路61号13号商铺,30.584455,114.299822
CHAGEE霸王茶姬(江宸龙湖天街店),青年路518号武汉江宸天街负二楼A-B2-37号,30.613217,114.2674
CHAGEE霸王茶姬(保利广场店),东湖新技术开发区关山大道332号武汉保利广场内B1层铺号B1-102号商铺,30.496036,114.417046
CHAGEE霸王茶姬(新唐万科店),新唐万科广场1号门01-41号铺位,30.629552,114.267767
CHAGEE霸王茶姬(银泰御华里店),怡和路1号银泰御华园三期S1栋1层11-12商铺,30.647184,114.314892
CHAGEE霸王茶姬(菱角湖万达广场店),唐家墩路菱角湖万达广场室内步行街1层1035B、1-36号铺,30.616431,114.276526
CHAGEE霸王茶姬(壹方南馆店),中山大道1515号武汉天地壹方南馆1层商11A单元,30.615101,114.316593
CHAGEE霸王茶姬(新世界百货徐东店),徐东大街31号武汉新世界千姿百货一层L01F145号商铺,30.594861,114.353028
CHAGEE霸王茶姬(武汉光谷德国风情街店),珞喻路766号德国风情街8号楼1层1027、1028,30.507056,114.415515
CHAGEE霸王茶姬(金桥永旺店),金桥大道15号金桥永旺梦乐城1楼143B号,30.636123,114.290398
CHAGEE霸王茶姬(金银湖万达店),金山大道1239号武汉金银湖万达广场1F层1002号商铺,30.643247,114.185381
CHAGEE霸王茶姬(武汉雄楚一号店),雄楚大道888号金地·雄楚1号一期商6栋1-4层11室,30.504128,114.397267
CHAGEE霸王茶姬(武汉绿地汉口中心店),塔子湖绿地汉口中心(二期)第S3幢/单元1层(15)商,30.66254,114.299992
CHAGEE霸王茶姬(武汉千禧城店),解放大道与古田三路交汇处千禧城K3项目L1层12、13、36、37号,30.602757,114.211193
CHAGEE霸王茶姬(大洋中心店),解放大道1381号南国中心2期一层B-F1-017号,30.591176,114.289097
沪上阿姨鲜果茶(银泰创意城店),珞喻路35号银泰创意城8楼8020室,30.532782,114.362735
沪上阿姨鲜果茶(黄陂广场店),黄陂大道黄陂广场DE栋1层123号,30.886134,114.381226
沪上阿姨鲜果茶(海林广场店),吴家山三秀路海林广场1层蔡林记前面,30.628371,114.150746
沪上阿姨鲜果茶(北辰光谷里店),高新二路9号北辰光谷里8栋101号铺,30.487189,114.422843
沪上阿姨鲜果茶(纱帽街店),纱帽街汉南大道488号,30.314924,114.09001
沪上阿姨鲜果茶(多莫大教堂店),武汉东湖新技术开发区光谷街20号光谷世界城康桥小区2栋2单元1层05号,30.508058,114.412075
沪上阿姨鲜果茶(武昌职业学院店),中洲路武昌职业学院东一门斜对面,30.378461,114.410155
沪上阿姨鲜果茶(硚口长风路店),长风路团结佳兴园14栋1楼2号,30.618491,114.213779
沪上阿姨鲜果茶(户部巷店),中华路街民主路65号2单元1-2层2室-2,30.552596,114.303967
沪上阿姨鲜果茶(东澜岸店),青菱街红霞村福星惠誉东澜岸40-1-6号商铺,30.438093,114.272603
沪上阿姨鲜果茶(青山恩施街店),恩施街17号附1号,30.627435,114.400822
沪上阿姨鲜果茶(五环天地店),虎泉街267号五环天地招商中心S1-2-1,30.511533,114.387631
沪上阿姨鲜果茶(金地自在城店),K3商业街D01号商铺,30.610574,114.391778
沪上阿姨鲜果茶(联投广场店),大桥现代产业园大桥村联投广场商业区二期第32号商业幢32-1单元一层83号房,30.379722,114.327506
沪上阿姨鲜果茶(奥莱西街店),盘龙城F绿岛奥莱西街S6-103号,30.738321,114.261469
沪上阿姨鲜果茶(蔡甸薛峰店),后官湖大道薛峰小区南区底商1层A区19号,30.465335,114.099997
沪上阿姨鲜果茶(泛悦西汇店),宗关街泛悦·南国广场A馆1层G-F1-073单元,30.590968,114.229612
沪上阿姨鲜果茶(博学路店),博学路2号潮海公寓13商铺116号,30.52762,114.162598
沪上阿姨鲜果茶(天河机场店),天河机场交通中心1F展一号商铺-1（天河机场地铁站B出口）,30.777476,114.223992
沪上阿姨鲜果茶(地大未来城店),锦程街68号中国地质大学未来城校区学生1食堂,30.461418,114.624557
沪上阿姨鲜果茶(新洲大礼堂店),邾城街新洲大街41-2号,30.849299,114.805849
沪上阿姨鲜果茶(软件新城店),东湖新技术开发区花山软件新城二期C9号楼1层部分区域,30.558698,114.509875
沪上阿姨鲜果茶(马湖商业街店),马湖商业街A2-107门面,30.480584,114.330995
沪上阿姨鲜果茶(南国北都店),姑嫂树路12号南国北都城市广场裙楼幢、单元1层1号房,30.632404,114.272685
沪上阿姨鲜果茶(湘隆时代广场店),湘隆时代商业中心A区9-13号,30.502444,114.174976
沪上阿姨鲜果茶(武汉江腾广场店),马鹦路117号江腾广场2号楼4层c2-4019号,30.543254,114.262257
沪上阿姨鲜果茶(武汉文华学院店),东湖新技术开发区创业街祥和雅居6栋1层605号、606号-7,30.5039,114.44254
沪上阿姨鲜果茶(经开万达金街店),东风东路万达广场A区S1幢1层B51号,30.513346,114.181349
沪上阿姨鲜果茶(凯德西城店),解放大道18号凯德广场05层04号电影院旁边,30.602668,114.19991
