奶茶店名称,地址,纬度,经度
古茗(湖北大学店),友谊大道373号附136号古茗,30.585165,114.336852
古茗(古田四路店),古田四路199号B区9号-11号,30.611642,114.224391
古茗(江汉路万达店),交通路万达广场c-1-32号,30.584286,114.299183
古茗(光谷天地店),关山大道光谷天地一期E-1F-039,30.484076,114.417158
古茗(光谷世界城店),珞喻路766号世界城广场B1,30.511842,114.411581
古茗(百花街店),百花街256号,30.313882,114.088933
古茗(南湖佰港城店),文治街维佳佰港城L1层16号,30.509538,114.332416
古茗(左岭新城店),九龙湖街左岭街祥龙社区底商,30.496331,114.626896
古茗(走马岭店),走马岭街道市场路50号,30.653627,114.035481
古茗(新洲摩尔城店),齐安大道98附3号,30.840744,114.810053
古茗(江汉路步行街店),江汉一路52号（璇宫饭店对面）,30.587113,114.296873
古茗(洪山虎泉店),卓刀泉街道虎泉街126号附5,30.516677,114.378557
古茗(江夏永旺店),文化大道199号永旺梦乐城3楼3035-1室,30.401948,114.322041
古茗(雄楚一号店),雄楚大道雄楚1号地一站甜品广场N605-1-1号商铺,30.504486,114.397061
古茗(华师南门店),桂元路140号,30.521372,114.363381
古茗(武汉江夏豹澥店),东湖高新区高新四路万年台生活广场北区一楼101号,30.468089,114.550049
古茗(百秀街店),百秀街98号,30.885916,114.379878
古茗(武昌理工店),江夏大道庙山产业园梅南山居商网1楼27号,30.419916,114.379317
古茗(江腾广场店),广电兰亭都荟1幢1单元-2层3号,30.542627,114.26229
古茗(武昌户部巷店),民主路户部巷8号,30.55271,114.304627
古茗(经开永旺店),经济技术开发区江城大道408号B座3楼313C,30.508412,114.21133
古茗(环球广场店),巨龙大道环球广场A区09号铺位,30.707268,114.296054
古茗(武大校内梅园店),八一路299号武汉大学东中区九栋一楼2105,30.539037,114.37091
古茗(江汉江宸天街店),青年路518号江宸天街负2楼A-B2-04号（近3号线范湖地铁站E口）,30.613099,114.26745
古茗(阳逻万达店),柴泊大道阳逻万达广场4055号四楼,30.697586,114.610061
古茗(百瑞景店),宝通寺路百瑞景商业街7栋7-1001,30.528167,114.34168
古茗(文华学院店),文化路文华学院5号铺,30.503105,114.443269
古茗(武汉华夏理工学院店),华夏理工大学校内菜鸟驿站3号铺,30.472457,114.418769
古茗(武工院校内店),武汉工程科技学院西门北侧约90米,30.354946,114.341027
古茗(武汉客厅店),湖北省武汉市东西湖区将军路街武汉客厅小型会展中心建设项目特色文化街区IIF栋1层02号,30.677215,114.285118
古茗(二七路店),二七路89附36号,30.632772,114.320198
古茗(首义泛悦汇店),首义广场泛悦汇一楼-KA街汉堡王隔壁,30.540412,114.311022
古茗(黄陂横店店),横店街是蓝色星城三期2栋1层8室,30.806561,114.301486
古茗(鲁磨路店),鲁磨路319号,30.519159,114.40646
古茗(锦绣龙城店),龙城路4附13号,30.472305,114.394944
古茗(东湖景园店),欢乐大道86号东湖景园A区3号楼121号商,30.58963,114.381731
古茗(江夏中百店),文华路37号江夏中百广场1楼107-01-043号商铺,30.370869,114.328009
古茗(汉口学院),大桥现代产业园文化大道299号汉口学院中央生活区1栋1楼29号,30.419824,114.32189
古茗(光谷科技港店),华师园北路光谷科技港1号楼一层20号,30.462931,114.405681
古茗(常青公寓店),公园南路常青花园公寓A栋1楼A-16号,30.646929,114.252226
古茗(汉正街店),武汉市硚口区多福路特58号汉正街品牌服饰批发广场F1,30.57597,114.283069
古茗(蔡甸健康谷新天地店),新天大道集贤健康谷新天地3-1-18,30.555383,114.118379
古茗(红桥城店),福星惠誉红桥城8号楼商-5号,30.669468,114.338733
古茗(曙光星城店),雄庄路6-108号曙光星城,30.489591,114.410034
古茗(中南财大小吃街店),南湖大道政院小区264栋一楼门面,30.48122,114.390613
古茗(文理学院店),武汉文理学院武湖校区和津堂6号门面,30.739391,114.419998
古茗(马湖店),马湖新村广寰商贸楼2栋1单元1楼20号,30.48035,114.331737
古茗(汉阳万达店),四新大道608号武汉汉阳万达广场3010号,30.536487,114.207391
古茗(青山商场店),和平大道1154号青山商场一层三号商铺,30.645089,114.410017
古茗(二师店),东湖技术开发区高新大道456号Z23幢1-2层4号商铺,30.490494,114.452597
古茗(知行学院店),谌家矶知行学院外寝新建村综合楼1楼4号,30.698231,114.379804
古茗(阳光一百店),杨桥湖大道藏龙岛阳光100大湖第四期商业53-B-102号商铺,30.408042,114.418926
古茗(怡华逸天地店),吴中街401号怡华-逸天地3号楼第1层18号商铺,30.635914,114.15054
古茗(工商学院店),黄家湖西路长江工商学院学生宿舍9栋1层03号铺,30.466781,114.283321
茶颜悦色(武汉天地店),芦沟桥路66号武汉天地7号楼1层,30.613029,114.317455
茶颜悦色(欧亚达游园会店),汉口站西路欧亚达国际广场L1层L1-02号商铺,30.620942,114.261081
茶颜悦色(湖经学院茶叶子店),藏龙岛科技园杨桥湖大道15号拓创产业园1层中百超市外租区WP-S-1-6,30.42602,114.436952
茶颜悦色(亚贸广场游园会店),武珞路628号武商亚贸广场购物中心1层,30.535562,114.349746
茶颜悦色(光谷世界城广场游园会店),湖北省武汉市洪山区珞喻路726号世界城广场2楼,30.512322,114.412482
茶颜悦色(德国风情街镖局店),步行街南路光谷世界城德国风情街F-711、F-712、F-7118-7120号,30.507017,114.41469
茶颜悦色(摩尔城店),龙阳湖北路摩尔城B1楼,30.564459,114.214552
茶颜悦色(美术馆镖局店),大智街道中山大道1059号,30.588312,114.299119
茶颜悦色(武汉大汉口城店),水塔街中山大道539号(水塔)生产综合楼6第一层1-3商铺,30.584889,114.296949
茶颜悦色(雄楚一号茶叶子店),雄楚大道888号季佳·荟雄楚1F层,30.503941,114.397773
茶颜悦色(漫时区茶叶子店),湖北省武汉市武昌区徐家棚街三角路村福星惠誉水岸国际6号地块漫时区项目3号楼1层3-117A、3-117B号,30.580359,114.330961
茶颜悦色(东澜岸广场店),东澜岸广场2-124号,30.438297,114.269673
茶颜悦色(中南中商茶叶子店),中南路9号中南广场W—2门面,30.542942,114.338519
茶颜悦色(花园道店),北湖街道青年路308号花园道一层C102室,30.601556,114.272349
茶颜悦色(江夏中商亭子店),梅南山居G区商业综合楼1F门前广场商亭,30.416761,114.3785
茶颜悦色(南湖城市广场店),建安街369号泛悦MALL南湖店A-F1-002铺位,30.510643,114.33137
茶颜悦色(群光广场店),珞喻路6号群光广场B1楼编号NO.A-14位置,30.531567,114.361745
茶颜悦色(五环天地店),虎泉街267号五环天地2-1-B01-03号,30.512212,114.387171
茶颜悦色(泛悦南国广场店),解放大道387号泛悦·南国广场A馆1层ZW1002单元铺位号为G-1-000,30.590296,114.229031
茶颜悦色(华罗利广场店),纺织路1号华罗利广场一层A-04-03,30.489297,114.402633
茶颜悦色(中商世界里店),珞喻路726号鲁巷广场购物中心B1层（中商超市入口对面）,30.511696,114.402207
茶颜悦色(取水楼店),新华路213号Z·YSTREET中英街1号楼1楼附5号,30.599363,114.279046
茶颜悦色(武汉新世界一楼茶叶子店),湖北省武汉市江汉区建设大道566号新世界百货一楼L01F032号商铺,30.600921,114.275882
蜜雪冰城(海林广场店),田园大道1116号海林广场1层,30.628525,114.150303
蜜雪冰城(光谷天地店),关山大道519号光谷天地1层,30.484582,114.416642
蜜雪冰城(大智路店),中山大道729号,30.593729,114.303106
蜜雪冰城(二七店),二七街解放大道2159号航天星都C8栋115室,30.630142,114.322835
蜜雪冰城(江汉路地铁B出口店),武汉轨道交通2号线江汉路地下商业街JH2-31商铺物业中A95号,30.58542,114.298387
蜜雪冰城(二中店),中山大道1560号,30.611522,114.315094
蜜雪冰城(户部巷店),湖北省武汉市武昌区民主路69号1-1号,30.552766,114.304517
蜜雪冰城(武昌火车站店),中山路653号1-4,30.533126,114.321318
蜜雪冰城(街道口店),珞狮路未来城B、C栋负1楼25室,30.531889,114.359774
蜜雪冰城(武音店),解放路284号,30.544666,114.304566
蜜雪冰城(中南店),中南一路3号嘉园大厦1、2栋-1层1室13-15号、1-3号,30.543692,114.338613
蜜雪冰城(马场角店),马场角小路36号华西公寓1层12号-2,30.614995,114.273153
蜜雪冰城(曙光星城中心店),雄庄路曙光星城C区3-116号,30.488673,114.410001
蜜雪冰城(奓山店),联富路8号,30.456473,114.022821
蜜雪冰城(江汉路烟火巷店),江汉路32号烟火巷美食街A-6号房屋,30.584366,114.301284
蜜雪冰城(堤角店),堤角前街6附10号,30.665306,114.348306
蜜雪冰城(兴业南路店),后湖街金桥大道18号新地盛世东方17栋1层3室兴业南路蜜雪冰城,30.644089,114.308427
蜜雪冰城(中商店),阳逻街阳光大道389号阳逻广场T1、T2栋一层34号,30.669022,114.573878
蜜雪冰城(磨山景区店),鲁磨路665号磨山景区南门驿站3栋02号,30.550254,114.4144
蜜雪冰城(龙阳村店),龙阳大道49号龙阳时代负一层08号A001-1商铺,30.557749,114.213613
蜜雪冰城(梨园店),湖北省武汉市武昌区沿湖大道20号,30.581,114.382129
蜜雪冰城(精典公寓店),石牌岭路精典公寓C104,30.532916,114.348823
蜜雪冰城(越秀星汇君泊店),塔子湖组团J地块S1幢1层商2号房,30.654906,114.288436
蜜雪冰城(华农1店),华中农业大学商业一条街C18梧桐路步行街6号商铺,30.480689,114.356411
蜜雪冰城(光谷二路商贸学院店),武汉商贸职业学院附近,30.445041,114.468366
蜜雪冰城(滠口店),滠阳大街120号,30.720174,114.360431
蜜雪冰城(恒大龙城店),盘龙城新力帝泊湾2-19号,30.727045,114.240051
蜜雪冰城(马湖店),野芷湖西路马湖南湖酒店用品大市场2034号店铺,30.480584,114.331548
蜜雪冰城(齐安大道店),齐安大道96号,30.841283,114.810107
蜜雪冰城(壹站城店),车场南路7号壹站城商业步行街1楼C21F59号,30.664358,114.258858
蜜雪冰城(武湖店),武湖农场正街冰晶天兴城小区6栋一层1号01,30.70798,114.425422
蜜雪冰城(烽火店),白沙洲大道208号外2号,30.509922,114.302195
蜜雪冰城(美院店),美术学院小吃街,30.395226,114.42585
蜜雪冰城(康桥店),东湖新技术开发区光谷街20号光谷世界城康桥小区2栋2单元1层07一1号,30.508022,114.412163
蜜雪冰城(武汉理工大学南湖校区北区校内店),文荟街武汉理工大学南湖校区教育超市内,30.515888,114.3352
蜜雪冰城(传媒店),藏龙北街商业街100号,30.445783,114.429268
蜜雪冰城(仓埠店),武滨路42号,30.839786,114.60968
蜜雪冰城(余华岭店),还建住宅H2地块余华岭佳园3-105-1号商铺,30.66344,114.290576
蜜雪冰城(武汉纺织大学外经贸学院校内店),经济开发区藏龙岛街道武汉纺织大学外经贸学院校内7栋11号商铺,30.392546,114.423029
蜜雪冰城(天河店),武汉市天河街道学府路22号,30.811203,114.225976
茶百道(二中店),中山大道1576号,30.61199,114.315406
茶百道(江汉路店),江汉一路璇宫电影院对面,30.587071,114.296823
茶百道(楚河汉街店),同成富苑裙楼1层5室A0103-1号房,30.562109,114.348637
茶百道(轻工大店),环湖中路36号轻工大学点点超市内1号商铺,30.660048,114.231166
茶百道(南湖店),建安街361号,30.510327,114.330697
茶百道(众圆广场店),建设二路36号附7号,30.632268,114.381378
茶百道(大智路店),中山大道1032号,30.593593,114.303288
茶百道(香港路店),香港路173号第一档门面,30.608861,114.29288
茶百道(左岭新城店),九龙湖街左岭新城三社区（超马鲜生旁）,30.496279,114.626932
茶百道(世达广场店),高新六路16号世达广场1楼A002号铺,30.444195,114.447759
茶百道(藏龙岛美院店),栗庙南路藏龙岛栗庙新村D003号商铺,30.394848,114.426292
茶百道(江夏永旺店),文化大道199号永旺超市一楼706号商铺,30.40228,114.325658
茶百道(汉商银座购物中心店),汉阳大道139号汉商银座B栋B1F-25,30.555077,114.273806
茶百道(阳逻广场店),阳逻街阳光大道317号,30.668222,114.573747
茶百道(武汉荟聚宜家广场),园博大道荟聚中心4楼西贝旁,30.622935,114.173861
茶百道(未来城店),珞狮南路147号未来城BC栋裙楼1层19号,30.531362,114.359602
茶百道(雪松路店),雪松路26号,30.598149,114.273539
茶百道(华农店),狮子山大道华中农业大学市场管理办公室步行街服务楼C32号门面,30.481211,114.35662
茶百道(金银湖199店),金银湖大厦,30.639186,114.211774
茶百道(江发路店),江旺路8号红T时尚创意街区5栋1层商亭,30.628192,114.242252
茶百道(雄楚1号店),东湖新技术开发区雄楚大道888号金地雄楚一号一期AXC1F1025号铺子,30.504027,114.396892
茶百道(粮道街店),湖北省武汉市武昌区粮道街244附1号茶百道,30.5528,114.318446
茶百道(华科店),华中科技大学东校区启明路,30.516487,114.438242
茶百道(庙山店),纸坊街道江夏大道庙山站19号,30.419319,114.37922
茶百道(泛悦汇店),中山路泛悦汇负一楼025商铺（昙华林）,30.557641,114.32287
茶百道(黄陂店),百秀街96号,30.885881,114.379889
茶百道(华生汉口城市广场店),长丰村汉丹铁路以南华生·汉口城市广场南区D1栋b单元1_2层,30.618199,114.213562
茶百道(群星城店),福星惠誉·群星城20号负一楼,30.590797,114.356028
茶百道(二七路店),二七路18附36号,30.632701,114.320972
茶百道(武展店),解放大道374号武展购物中心回廊A7、8铺（近中山公园地铁站B出口）,30.587384,114.279248
茶百道(理公馆店),工大路与雄楚大道交叉口理公馆9号商铺,30.519301,114.352006
茶百道(武汉恩施街店),黄州街16附5号,30.627406,114.401277
茶百道(印象城店),和平大道印象城in巷L1-39商铺,30.638051,114.397358
茶百道(东湖景园店),东湖景园,30.590401,114.380269
茶百道(范湖万达店),云彩路198号武汉范湖万达广场B1层,30.609347,114.262159
茶百道(百瑞景店),瑞景路8号百瑞景中央生活区商业街4栋1层1室,30.527181,114.340585
茶百道(阳光100店),湖北省武汉市江夏区杨桥湖大道2号阳光100大湖第四期53B-104号,30.408121,114.419013
茶百道(大泽东西湖中心广场店),东吴大道83号,30.6297,114.145173
茶百道(金地澜菲溪岸店),芳草六街金地澜菲溪岸J8区E22栋1-2层2号商铺,30.519171,114.218683
茶百道(经开万达店),体育路万达广场A区S1栋1层B7室,30.512274,114.181013
茶百道(金融港店),光谷大道77号光谷金融港创客星106-1,30.461978,114.428043
茶百道(万松园店),万松园路78号附1,30.590694,114.274898
茶百道(解放公园店),解放公园路41号育才高中旁边,30.609632,114.305933
茶百道(武汉大学正门店),珞南街明家湾武大路66号,30.538397,114.362983
茶百道(九峰店),玉合巷三星苑1楼S41号,30.50828,114.48975
茶百道(武汉黄陂横店),蓝色星城三期1.3幢1层17号,30.804827,114.300703
茶百道(硚口越秀店),中山大道越秀·星汇云锦,30.576956,114.256857
茶百道(轻工大学店),公园南路常青公寓A栋1楼A-1号门面,30.64631,114.252516
茶百道(新福茂店),新福路新福茂中央广场F1层F166号,30.586719,114.038878
茶百道(青山商场店),沿港路青山百货商场1层,30.644821,114.410202
茶百道(万隆广场店),白沙洲大道404号万隆广场F1层,30.525126,114.310508
茶百道(销品茂店),中商世界里·鹏程销品茂购物中心五楼,30.594144,114.349148
茶百道(恒大影城店),柏环二路恒大城市广场1层17附47号,30.666854,114.177394
茶百道(广宏汇店),南湖大道48-37号,30.486701,114.339594
1点点(古田凯德店),古田二路凯德广场B1层48B,30.603307,114.200312
1点点(黄陂店),前川街道百秀街104号(黄陂广场旁),30.886108,114.379856
1点点(岳家嘴金禾店),徐东大街191号金禾时尚中心一楼117号商铺,30.583448,114.370252
1点点(武广店),解放大道684号附34号,30.585675,114.273772
1点点(光谷金融港店),东湖新技术开发区流芳路大舒村商网B栋2楼4号商铺,30.463499,114.439657
1点点(武音店),解放路286-1-1号,30.544633,114.304556
1点点(光谷德国风情街店),梳子桥路光谷德国风情街8栋81020商铺,30.506767,114.415926
1点点(二中店),中山大道1455号,30.61107,114.314563
1点点(happy站台店),中山大道818号平安大厦B1层C135A号,30.58504,114.297915
1点点(汉街店),中北路武汉楚河汉街1F层YX-WS-016,30.562493,114.348916
1点点(街道口店),武珞路824号（街道口地铁A出口西30米）,30.532945,114.358459
1点点(武汉大悦城店),光谷大悦城购物中心B1-55A号商铺,30.494414,114.504648
1点点(南湖城市广场店),紫阳街道建安街风华天城流云湾5-14号。(南湖沃尔玛西侧50米),30.510326,114.330401
1点点(群光店),珞喻路6号群光广场B1层A-21铺,30.531597,114.361819
1点点(蔡甸店),汉阳大街74附4,30.585956,114.037633
1点点(街道口创意城店),珞喻路35号银泰创意城8层013-A,30.532892,114.36262
1点点(百步亭店),百步亭花园路万家汇壹层S1-28号商铺,30.658908,114.322096
1点点(汉口火车站店),汉口站西路汉口火车站地铁大厅负一楼CD出口,30.6212,114.260731
1点点(中南天紫店),中南一路3号中南天紫广场A馆1层,30.543667,114.338772
1点点(黄家湖店),丽水南路福星惠誉·东澜岸34-59号楼小区底商10号,30.439329,114.272657
1点点(武昌工学院店),白沙洲大道108号青润家园7号楼A座1层6号商铺,30.493809,114.288273
1点点(吴家山中心广场店),五丰街吴家山中心广场1－17,30.628987,114.145802
1点点(江夏名城店),红花路大花岭小区A14栋,30.420475,114.318393
1点点(雄楚一号店),湖北省武汉市洪山区雄楚大道雄楚一号一期第一层N159号,30.504533,114.396859
1点点(梅苑小区地铁店),地铁4号线梅苑小区站D出口,30.537086,114.332525
1点点(光谷天地店),关山大道519号光谷天地1层GF-011,30.48338,114.416734
1点点(菱角湖万达店),唐家墩路5-1号万达广场万达金街B022,30.616591,114.274089
1点点(光谷科技港店),华师园北路科技港1016,30.462974,114.405545
1点点(文华学院店),文华路祥和雅居9栋对面临街商6号,30.503106,114.443304
1点点(盘龙城万达广场店),巨龙大道盘龙城万达广场B1F乐美享美食城4-3号商铺,30.699882,114.311494
1点点(钟家村店),湖北省武汉市汉阳区汉阳大道139号汉商银座购物中心B1,30.554942,114.27381
1点点(长港路地铁店),常青五路88号金色雅园C区2栋1层6室（长港路地铁站F出口东行150米）,30.633324,114.254491
1点点(钟家村家乐福店),汉阳大道钟家村地铁A出口家乐福门口,30.556199,114.271349
1点点(印象城店),和平大道武汉印象城一层1-40商铺,30.638217,114.397396
1点点(武汉大学正门店),珞珈山路88号,30.537853,114.362232
1点点(徐东中商平价店),徐东大街7号中商平价广场1楼外围商铺,30.596686,114.350898
1点点(虎泉店),卓刀泉特一号虎泉购物广场一层,30.520278,114.375588
1点点(南大天地店),葛洲坝南大天地,30.579791,114.258778
1点点(经开万达店),东风东路经开万达广场金街1楼B17号,30.512549,114.181167
1点点(泛悦汇昙华林店),螃蟹岬泛悦汇昙华林B2-16-1,30.557637,114.323064
1点点(中南财经政法大学店),中南财政政法大学西苑政院小区41排193号楼,30.481392,114.390751
1点点(汉南店),百花街161号,30.3134,114.088881
1点点(江汉大学店),博学路联头金色港湾D栋1层07号商铺,30.524437,114.161588
1点点(汉正国际店),中山大道汉正国际中心第一层一区街004号,30.580005,114.287584
1点点(水塔店),前进五路水塔消防队旁,30.585269,114.296173
1点点(光谷西班牙风情街店),世界城光谷步行街D地块公共区域1层D-1DE-01号,30.50872,114.412645
1点点(越秀星汇君泊店),后湖街越秀星汇君泊108号商铺,30.655563,114.287782
1点点(奥山世纪城店),和平大道奥山世纪广场3号楼2层G2001,30.62373,114.367207
1点点(汉阳麦德龙店),芳草路97号纽宾凯国际社区-蜜城k9地块3号楼1层3103铺,30.538851,114.212181
1点点(江夏九全嘉店),北华街北侧城关村九全嘉购物广场第1栋1层特1号,30.364331,114.335377
1点点(万科未来中心店),湖北省武汉市汉阳区汉阳大道408号(地铁4号线五里墩站C出口)万科未来中心VFCB1,30.560571,114.250616
1点点(马湖店),马湖酒店用品大市场新2栋1楼111号,30.480585,114.330837
1点点(汉广店),建设大道延长线与幸福大道交汇处汉口城市广场二期商业B-2区1层10号房,30.657545,114.313049
喜茶(荟聚中心店),长宜路1号荟聚中心L2层（宜家中庭）,30.623419,114.173137
喜茶(武汉世界城广场店),东湖高新技术开发区珞喻路766号世界城广场L1层GC102号,30.511526,114.410733
喜茶(武汉龙湖江宸天街店),青年路518号武汉江宸天街A-1F-09ba号,30.613312,114.268597
喜茶(武汉江汉路X118店),江汉路118号X118一楼帝盛酒店旁,30.588373,114.296657
喜茶(武汉天地壹方南馆店),中山大道武汉天地壹方南馆一楼102商铺,30.614517,114.315766
喜茶(武汉黄陂广场店),黄陂广场二期A.B.J栋J单元1层五室,30.886098,114.383021
喜茶(武汉街道口未来城店),珞狮南路147号,30.531494,114.359664
喜茶(武汉青山印象城店),和平大道1278号武汉青山印象城L1-37号商铺,30.63767,114.397458
喜茶(武汉汉口城市广场店),后湖大道汉口城市广场ABC区一楼C2号商铺,30.657963,114.314828
喜茶(武汉华罗利广场店),民族大道纺织路1号华罗利广场A-09-02,30.489097,114.402642
喜茶(武汉汉阳万达广场店),四新大道608号万达广场室内步行街1F层1022号商铺,30.535675,114.207501
喜茶(武汉凯德广场西城店),解放大道18号凯德广场西城店01层10号,30.602445,114.200491
喜茶(武汉国金天地店),新华路越秀国金天地P5栋一层J1027号,30.591543,114.283405
喜茶(武汉洪山万科广场店),白沙二路洪山万科广场L1层27号,30.489175,114.280853
喜茶(武汉东西湖径河广场店),十字路原金河商城售楼部,30.68415,114.169766
喜茶(武汉雄楚一号购物广场店),雄楚大道888号金地雄楚1号季佳荟雄楚一期AXC1F1043号商铺,30.504527,114.396518
喜茶(武汉光谷青年汇店),光谷青年汇1-01-02,30.445271,114.428771
喜茶(武汉绿地汉口中心店),塔子湖街健康路66号绿地·汉口中心(二期)第S4-a幢/单元1层(2)商号,30.662362,114.299641
书亦烧仙草(happy站台店),中山大道818号平安大厦负一层D036号,30.584372,114.298181
书亦烧仙草(江腾广场店),国博大道广电兰亭都荟1幢一单元第1-2层10附1号,30.54274,114.26186
书亦烧仙草(红钢城店),红钢城工业三路2号1栋1层6号,30.642328,114.407199
书亦烧仙草(吴家山四明路店),东吴大道166号南5号,30.629529,114.147858
书亦烧仙草(中商平价店),红旗街23附46,30.84678,114.807006
书亦烧仙草(粮道街店),粮道街56号附1号,30.553724,114.31184
书亦烧仙草(黄陂广场店),黄陂广场步行街6号商亭,30.885881,114.382069
书亦烧仙草(武汉黄陂巨龙大道地铁站店),巨龙大道龙城·天居园101-6号,30.717155,114.2604
书亦烧仙草(创业路店),建银商务公馆C幢3号房,30.498378,114.168378
书亦烧仙草(文兴路店),汉阳大街58号,30.589197,114.033077
书亦烧仙草(欧亚达店),二环线汉口火车站西侧天丰综合楼欧亚达国际广场负一层公元铭美食城A12档口,30.621028,114.260915
书亦烧仙草(汉阳玫瑰街店),十里玫瑰一期1栋11号门面,30.570163,114.229412
书亦烧仙草(龙城路店),民族大道888号锦绣龙城I区12栋1层16室,30.471636,114.390899
书亦烧仙草(径河广场店),十字西街21号,30.684115,114.169868
书亦烧仙草(国贸店),劲松巷12号取水楼小学旁20米,30.59938,114.276127
书亦烧仙草(海伦春天店),四新南路916号海伦春天1期1栋1单元1楼2号,30.538091,114.191015
书亦烧仙草(中百广场店),文化路37号中百广场一楼,30.370682,114.327657
书亦烧仙草(黄浦中百店),黄浦大街218号,30.623697,114.307542
书亦烧仙草(南湖店),文治街46号学府林居二期7-112号,30.510397,114.332405
书亦烧仙草(解放公园路店),育才高中门口,30.609471,114.306423
书亦烧仙草(美术学院店),栗庙南路栗庙新村D002号,30.39498,114.426146
书亦烧仙草(一食万巷店),湖北省武汉市江汉区大智街道江汉一路58号一食万巷美食综合体(01C06-1号),30.587403,114.297322
书亦烧仙草(新荣店),解放大道1号线新荣地铁站c出口（Today便利店隔壁）,30.662238,114.340748
书亦烧仙草(青山恩施路店),恩施街13附6-2号,30.62742,114.400084
书亦烧仙草(南大天地店),硚口路葛洲坝城市花园二期12栋单元1层49号,30.579792,114.258418
书亦烧仙草(梅南山居店),庙山产业园梅南山居商网35号一楼,30.42034,114.379385
书亦烧仙草(大华滨江天地店),旅大街21号大华滨江天地K3南三期12、13单元1-2层3商号,30.629663,114.371225
书亦烧仙草(洪山区关南店),高新二路关南工业园T6栋1楼108号,30.483022,114.441149
书亦烧仙草(国博新城店),秋礼街6号国博新城,30.514484,114.237257
